{
  "protocol_version": "0.1",
  "device_id": "random-resettable-id",
  "sequence": 42,
  "sampled_at": null,
  "temperature_c": 23.4,
  "relative_humidity_pct": 18.2,
  "gross_mass_g": 812.0,
  "net_mass_estimate_g": 574.0,
  "stable": true,
  "calibration_state": "valid",
  "quality": {
    "environment": {
      "state": "fresh",
      "sample_age_ms": 700
    },
    "mass": {
      "state": "fresh",
      "sample_age_ms": 250,
      "uncertainty_g": null
    }
  },
  "faults": [
    "uncertainty_not_characterized"
  ]
}
